ID,Name,Parent,URL,Summary
SAL-ENA-1,Use playbooks,Enablement,https://knowledge.hubspot.com/playbooks/use-playbooks,"Learn how to use playbooks to allow your sales and services team members to reference and create standardized notes when speaking with prospects and customers.… An assigned Sales or Service seat is required to create, edit, view, and delete playbooks. With the playbooks tool, you can create interactive content cards displayed in contact, company, deal, and ticket records. When speaking with prospects and customers, your team can reference these and create..."
SAL-ENA-5,Share sales content with users and teams,Enablement,https://knowledge.hubspot.com/sequences/share-sales-content-with-users-and-teams,"Share or restrict access to the sequences, documents, playbooks and templates in your account.… After creating a sequence, template, playbook, or document in your account, you can share or restrict access to the sales content. You can restrict access so your team members can only view the content needed for their roles. In your sequences, templates, playbooks, or documents library, you can… filter by the content owner using the Owner dropdown menu. Share a sequence, template, playbook, or document To configure your sharing settings: In your HubSpot account, navigate to sequences, documents, playbooks, or templates. Hover over the sequence, document,…..."
SAL-ENA-1,Create and use snippets,Enablement,https://knowledge.hubspot.com/conversations/use-snippets,"Snippets are short, reusable text blocks that can be used on contact, company, deal, ticket, and custom object records. You can insert snippets into email templates, chat conversations, and when logging an activity or note. If you want to create reusable emails, learn more about the templates tool..."
SAL-ENA-3,Opprett og bruk snippets,Enablement,https://knowledge.hubspot.com/no/conversations/use-snippets,"Snippets er korte, gjenbrukbare tekstblokker som kan brukes på kontakt-, firma-, avtale-, billett- og egendefinerte objektposter. Du kan sette inn tekstutdrag i e-postmaler, chattesamtaler og når du logger en aktivitet eller et notat. Hvis du vil opprette gjenbrukbare e-poster, kan du lese mer om… kodebit. Administrere utdrag Du kan redigere, klone, flytte og slette utdrag på dashbordet for utdrag. Brukere med et nødvendig sete og Sales-tilgang kan redigere eller slette utdrag. Gå til CRM > Tekstutdrag i HubSpot-kontoen din. Bruk søkefeltet øverst til venstre for å søke opp et utdrag etter navn… dialogboksen velger du en mappe for utdraget, og klikker deretter på Flytt. Klikk på Slett for å slette utdraget. I dialogboksen klikker du på Ja, slett utdrag. Slik oppretter du…… ..."
CUS-CS-1,Reporting & Data,CS Leadership,https://knowledge.hubspot.com/reporting-and-data,
CUS-CS-1,Use dashboards in the mobile app,CS Leadership,https://knowledge.hubspot.com/dashboards/use-dashboards-in-the-mobile-app,"Manage and create HubSpot dashboards and reports on the go with the mobile app, using intuitive controls and AI-powered features for seamless performance tracking.… You can view your dashboards and create reports in the HubSpot mobile app using your mobile phone. This can be useful if you're on the go and need to review your performance. View and filter your dashboards in the mobile app Open the HubSpot app on your iOS or Android device. Tap dashboards"
CUS-CS-3,Share or export reports and dashboards,CS Leadership,https://knowledge.hubspot.com/dashboard/email-or-export-reports-and-dashboards,"Learn about the ways that you can export individual reports and dashboards, including setting up recurring daily, weekly, and monthly emails.… Share reports and dashboards with your team. You can share reports and dashboards via email, Slack, and Google Chat once or on a recurring basis depending on the report or dashboard’s configuration. Share a report From the reports dashboard, you can export a report as a CSV or Excel file, or email..."
CUS-CS-1,Use marketing reports in the marketing analytics suite,CS Leadership,https://knowledge.hubspot.com/reports/use-marketing-reports-in-the-marketing-analytics-suite,"Learn how to create marketing reports using the marketing analytics tool.… analytics A Marketing Hub Enterprise subscription is required to view customer journey analytics. In the top bar, navigate to a customer journey analytics template. Types of reports include: Lifecycle stage progression: measures the conversion rates between stages in the journey. This report…..."
CUS-CS-3,Analyze all segments,CS Leadership,https://knowledge.hubspot.com/segments/analyze-segments,"over the line between stages. In the pop-up, review the number and percentage of contacts that moved between the stages and the average time it took. To view the specific contacts, click the line. Learn more about customer journey analytics. Analyze overlap of contact segments To review which contacts… segments To track how contacts in segments move through steps in your customer journey, review the Segment journey report. Subscription required A Marketing Hub or Content Hub Professional or Enterprise subscription is required to use the…..."
CUS-CS-4,Customer journey report steps and filters,CS Leadership,https://knowledge.hubspot.com/reports/customer-journey-report-steps-and-filters,"Learn more about common steps and filters when creating a customer journey report.… When creating a customer journey report, use steps and filters to define the journey a contact or deal must take. The sections below highlight some of the most common steps and filters to use in your customer journey analytics report. Steps Steps are the individual events that a contact or deal..."
CUS-CS-6,Create a report with journey analytics,CS Leadership,https://knowledge.hubspot.com/reports/create-a-journey-report,Learn more about creating a journey report to track customers interactions on your website.… Customer journey analytics help you understand how every interaction with your business affects customers. Use customer journey reports to see which touchpoints are most effective at attracting customers and to track a contact's or deal's progress through different stages. The conversion rate...
CUS-FRO-2,Sync and manage help desk tickets in Slack,Frontline Managers,https://knowledge.hubspot.com/help-desk/sync-and-manage-help-desk-tickets-in-slack,"Connect help desk to Slack to manage tickets and receive HubSpot notifications in Slack.… You can connect help desk to Slack to manage tickets and receive HubSpot notifications in Slack. Customize ticket filtering to ensure relevant information reaches your team, sync internal comments, and update ticket properties from Slack, enhancing cross-team collaboration and efficiency. Before… dropdown menu and select a Slack channel to send tickets to. Click the TicketProperty dropdown menus to select a ticket property and its value. To remove a…..."
CUS-FRO-2,Analyze customer agent's performance,Frontline Managers,https://knowledge.hubspot.com/customer-agent/analyze-your-customer-agents-performance,"Track and enhance your customer agent's performance with HubSpot's Breeze AI. Monitor key metrics, identify knowledge gaps, and improve efficiency.… In the left sidebar menu, click Analyze > Reports. Review the following reports: Impact this week: overview of the number of conversations resolved and handled this week, the average resolution time, deflection rate, and the percentage of visitor feedback indicating the agent was helpful. Conversations..."
CUS-FRO-3,Manage the customer agent's identity,Frontline Managers,https://knowledge.hubspot.com/customer-agent/manage-the-customer-agents-identity,"Manage your customer agent's identity, including avatar, name, personality, and language preferences, to align with your brand and business model.… Manage your customer agent's core identity, including its avatar, name, and personality. When you deploy your customer agent to channels, the avatar and name are visible to customers. You can also select a personality that aligns with you brand and business model. For example, organizations… : you can edit your customer agent’s identity without using HubSpot Credits. However, deploying the customer agent to channels requires HubSpot Credits. Learn more…… ..."
CUS-FRO-4,Manage the customer agent's channel settings,Frontline Managers,https://knowledge.hubspot.com/customer-agent/manage-the-customer-agents-channel-settings,"Configure your customer agent's behavior across messaging and email channels to enhance your support strategy with tailored settings for efficient contact management and response handling.… to select a time period for when inactive conversations should close. Configure email channel settings Manage the customer agent’s behavior for email channels, including who it replies to, how it handles inactive threads, and which email addresses or domains to ignore. In your HubSpot account..."
CUS-FRO-5,Manage the customer agent's content sources,Frontline Managers,https://knowledge.hubspot.com/customer-agent/manage-the-customer-agents-content-sources,"Optimize your customer agent by managing content sources effectively. Learn how to add, edit, or remove content to improve response accuracy and customer satisfaction.… Content sources are used by the customer agent to answer customers' questions. When you create the customer agent, you'll be prompted to upload the content sources it will use to generate responses. You can add, edit, or remove its content sources at any time. For example, you can train… the customer agent using your company's website URL or by uploading a file of relevant information, such as your returns policy. When customers…..."
CUS-FRO-6,Set up and customize the customer agent's handoff process,Frontline Managers,https://knowledge.hubspot.com/customer-agent/set-up-and-customize-the-customer-agents-handoff-process,"Learn how to configure and customize your customer agent's handoff rules and process for seamless transitions to human agents.… After you've created your customer agent, manage how and when it hands off conversations across all channels from a centralized location. Create custom handoff triggers and choose to transfer conversations to a live human agent immediately, at a later time, or keep the customer agent assigned..."
CUS-FRO-1,Interact with reports in the report viewer,Frontline Managers,https://knowledge.hubspot.com/reports/interact-with-reports-in-the-report-viewer,"The report viewer lets you save and quickly switch between up to five unique visual configurations within a single report… The report viewer lets you save and quickly switch between up to five unique visual configurations within a single report. It offers an intuitive interface for analyzing, filtering, and gaining insights from your reports without needing to manually reconfigure or duplicate reports. Access the report..."
CUS-FRO-2,Use a report from the report library,Frontline Managers,https://knowledge.hubspot.com/reports/use-a-report-from-the-report-library,"Learn how to find a standard report from the report library and save it to your dashboard or reports list.… HubSpot's report template library contains standard reports that you can save to your reports list or add to your dashboards. These reports cover many different topics such as website performance and sales metrics. To find a suitable standard report: In your HubSpot account, navigate to Reporting..."
CUS-FRO-3,Create reports with the custom report builder,Frontline Managers,https://knowledge.hubspot.com/reports/create-reports-with-the-custom-report-builder,"Learn how to create reports with the new custom report builder.… With HubSpot's custom report builder, you can analyze multiple data sources across HubSpot. The difference between the custom report builder and other types of HubSpot reports is that you can surface data from marketing and sales activities in addition to objects. For example, you can create..."
CUS-FRO-4,Manage reports in your reports list,Frontline Managers,https://knowledge.hubspot.com/reports/manage-reports-in-your-reports-list,"Learn how to manage your reports with the reports list.… You can create new reports and manage any existing reports you have in your account using your reports list. If you want to analyze your dashboard reports instead, learn how to filter reports on your dashboard and how to filter your dashboard. Filter the reports list In your HubSpot account..."
CUS-FRO-5,Create goal reports in the custom report builder,Frontline Managers,https://knowledge.hubspot.com/goals/create-goal-reports-in-the-custom-report-builder,"With the custom report builder, you can report on goals alongside deals and other CRM data.… With the custom report builder, you can report on goals alongside deals and other CRM data. Select goals as the primary data source, join it to deals, and optionally, join deals to contacts, companies, activities, meetings, and other CRM objects using cross‑object reporting. Use case A vice..."
CUS-FRO-6,Report on forms using the custom report builder,Frontline Managers,https://knowledge.hubspot.com/forms/report-on-forms-using-the-custom-report-builder,"Learn how to create reports for forms using the custom report builder.… to measure form performance, track submissions, and analyze conversion rates for your forms. Before you get started Before you use this feature, review the user permission requirements and limitations of creating a custom forms report. Understand limitations and considerations You can create custom..."
CUS-SER-2,Set up help desk,Service Ops,https://knowledge.hubspot.com/help-desk/overview-of-the-help-desk-workspace,"Help desk is a central location in your HubSpot account where you and your team can manage tickets. Learn how to connect channels, organize tickets, set up settings, and efficiently manage customer inquiries in one central location.… Such as custom views, SLAs, and reply recommendations. Set up help desk If this is your first time setting up help desk, you'll be guided through a setup flow to help you customize the workspace.…..."
CUS-SER-6,Route tickets in help desk,Service Ops,https://knowledge.hubspot.com/help-desk/route-tickets-in-help-desk,"Route help desk tickets manually or automatically, ensuring efficient ticket management based on user skills and availability.… In help desk, incoming tickets are left unassigned by default. Learn how to manually assign tickets, or if you're assigned a Service Hub seat, set up automatic routing rules so that tickets are automatically routed to specific users and teams in your account. You can also create skills for your… account's users and then route help desk tickets to users based on their skills. Learn more about skill-based routing.…..."
CUS-SER-3,Set up and manage object pipelines,Service Ops,https://knowledge.hubspot.com/object-settings/set-up-and-customize-pipelines,"Learn how to create, clone, customize and delete your pipelines and stages in HubSpot.… Pipelines help visualize your processes through stages, which are steps that signal where a record is in a process. For example, you can create deal pipelines to track revenue, ticket pipelines to track customer issues, or listing pipelines to track for-sale properties. Please note: your account… that categorize records. Click the Pipeline Rules tab to set up rules for a deal, ticket, lead, order,…..."
CUS-SER-4,Support your customers,Service Ops,https://knowledge.hubspot.com/get-started/support-your-customers,"A contact record, or your conversations inbox. Create tickets Set up ticket pipelines and statuses Manage tickets in your inbox Manage tickets in help desk Set up pipeline automation Create a knowledge base to help your customers self-serve (Service Hub Professional and Enterprise) Create a knowledge..."
CUS-SER-1,Manage customer portal settings,Service Ops,https://knowledge.hubspot.com/inbox/manage-customer-portal-settings,"Manage your customer portal settings, including domain, access control, ticket display, and support forms, to enhance user experience and streamline support interactions.… If you change your domain's language in your Domains & URLs settings, the customer portal language will also update. Learn more about HubSpot's language offerings. Please note: multiple language customer portals are not supported at this time. Edit the default inbox or help desk You can select..."
CUS-SER-2,Set up a customer portal,Service Ops,https://knowledge.hubspot.com/inbox/set-up-a-customer-portal,"A customer portal is a home behind a login where customers can view, open, and reply to their support tickets.… you've set up your customer portal, configure its settings. For example, you can edit the portal’s domain, customize how tickets appear, manage consent notice settings, or add a support form. Learn more about managing the customer portal."
CUS-SER-3,Set up customer success rooms,Service Ops,https://knowledge.hubspot.com/customer-success/use-customer-success-rooms,"Enhance collaboration with customer success rooms. Streamline projects, track tasks, and manage documents within a dedicated workspace for customers."
CUS-SER-4,Create and manage access groups for private content,Service Ops,https://knowledge.hubspot.com/website-pages/require-member-registration-to-access-private-content,"customer portal access Permissions required Customer Portal settings permission is required to limit customer portal access. In your HubSpot account, navigate to Service > Customer Portal. Click the Advanced tab and then click Access. In the Access Control section, select Access group membership..."
CUS-SER-6,Supported file types and sizes,Service Ops,https://knowledge.hubspot.com/files/supported-file-types,are supported when sending an attachment to a website visitor in a chat conversation: video audio json ms-excel ms-powerpoint msword pdf gif jpeg jpg png tiff calendar css csv plain-text vnd zip Customer Portal The file size limit for customer portals is 50MB. The following file types are supported when...
CUS-CUS-1,Determine likelihood to close with predictive lead scoring,Customer Success Reps (CSMs),https://knowledge.hubspot.com/properties/determine-likelihood-to-close-with-predictive-lead-scoring,"Learn about and use the Likelihood to close and Contact priority properties to predict which of your contacts are most likely to become customers.… on this predictive lead scoring model. Learn more about these properties: Likelihood to close: a score that represents the percentage probability of a contact closing as a customer within the next 90 days based on certain contact properties and activities. For example, contacts with a close probability value of 22… have a 22% chance of closing as a customer in the next 90 days. Contact priority: a ranking of contacts evenly distributed into tiers based on their Likelihood to close scores. The options for the…..."
CUS-CUS-2,Understand the lead scoring tool,Customer Success Reps (CSMs),https://knowledge.hubspot.com/scoring/understand-the-lead-scoring-tool,"Learn more about how lead scores are calculated, including use cases and best practices for setting up scoring.… the goals of your different teams or regions. Certain scores may be useful to sales and marketing teams tracking prospects, but your support team would need a different score to track the engagement of existing customers. If your business has multiple regions, the qualities of a good fit customer… property or event in your score. Note the following about criteria in the lead scoring tool: Separate property or event rules independently update the score, even if the rules are in the same group. For example, in a property group, you have one property rule that adds 10 points for Industry is Hospitality..."
CUS-CUS-2,Manage upcoming client renewals,Customer Success Reps (CSMs),https://knowledge.hubspot.com/no/partner-tools/manage-upcoming-client-renewals,"Lær hvordan du administrerer kommende kundefornyelser på HubSpot Partner-dashbordet… Merk: : Denne artikkelen er oversatt av praktiske årsaker. Oversettelsen opprettes automatisk ved hjelp av oversettingsprogramvare, og det er ikke sikkert at den er korrekturlest. Den engelske versjonen av denne artikkelen skal regnes som den regjerende versjonen med den nyeste informasjonen. Du..."
CUS-CUS-3,Manage upcoming client renewals,Customer Success Reps (CSMs),https://knowledge.hubspot.com/partner-tools/manage-upcoming-client-renewals,"Learn how to manage upcoming client renewals on your HubSpot Partner dashboard.… the following information for clients who have upcoming renewals: Client: name of the client, with a link to their client record. Products: the client's HubSpot subscriptions. MRR Change: the anticipated change in the client's monthly recurring revenue based on their renewal status. Last active… employee: the user who was last active in the client's HubSpot account. Renewal Manager: the HubSpot employee who is managing the client's renewal. Time to Renewal: when the client's contract will renew. Partner Tools Thank you…..."
CUS-CUS-1,Organize your feedback surveys,Customer Success Reps (CSMs),https://knowledge.hubspot.com/customer-feedback/organize-your-feedback-surveys,"Organize and manage your feedback surveys with advanced filtering, saved views, and customizable columns for insightful analysis.… satisfaction (CSAT), Custom survey, or Customer loyalty (NPS). Delivery: chat, email, shareable link, or web. To add quick filters, click + More, and then select a property. To refine your search using other filters, click Advanced filters. Learn more about filtering records and views. To customize… Organize and analyze your feedback surveys in HubSpot using filtering, save views, and customizable columns. Review responses, and tailor your survey data to fit your team's workflow. View and organize records with filters, and save…..."
CUS-CUS-2,Sync SurveyMonkey data to HubSpot surveys,Customer Success Reps (CSMs),https://knowledge.hubspot.com/integrations/sync-surveymonkey-data-to-hubspot-surveys,"users to provide their email address. NPS: it allows users to measure their satisfaction with your organization, brand, product, or service. Date/Time: it allows users to provide a specific date and time. Please note: For Date/Time questions, only the date will sync to HubSpot; the time won't sync… With HubSpot’s SurveyMonkey integration, you can sync SurveyMonkey data to HubSpot's native survey and survey response objects. Analyze, report, and take actions on your surveys in one place, including: Have records in HubSpot for each SurveyMonkey survey and its responses. Create dashboards..."
CUS-CUS-3,Create and conduct customer satisfaction surveys,Customer Success Reps (CSMs),https://knowledge.hubspot.com/customer-feedback/create-and-send-customer-satisfaction-surveys,"A Customer Satisfaction (CSAT) score tells you how satisfied a customer is with a product, service, or experience. It measures how a customer feels about a brand interaction. Use customer satisfaction surveys to ask contacts for feedback on their experiences or interactions with your business. You… can send this type of survey through email or chat, or display it on any page that has your HubSpot tracking code installed. Please note: users must have an assigned Service Hub seat to create feedback surveys. Learn more about HubSpot's new seats-based pricing In your HubSpot account, navigate… to Service > Feedback Surveys. To create a new survey: Click Create…..."
CUS-CUS-4,Create and conduct customer loyalty surveys,Customer Success Reps (CSMs),https://knowledge.hubspot.com/customer-feedback/how-do-i-send-a-customer-loyalty-survey,"Customer loyalty (NPS) surveys track how likely your customers are to recommend your company to other people. You can send this type of survey through email, or display it on any webpage that has your HubSpot tracking code installed. Please note: you must have an assigned Service Hub seat to create… feedback surveys. Learn more in HubSpot's Products & Services catalog. To set up a customer loyalty survey: In your HubSpot account, navigate to Service > Feedback Surveys. To create a new survey: In the top right, click Create Survey. In the left panel, click Customer loyalty. Select a delivery..."
CUS-CUS-5,Create and conduct customer support surveys,Customer Success Reps (CSMs),https://knowledge.hubspot.com/customer-feedback/how-do-i-send-a-customer-support-survey,"Customer Effort Score (CES) measures the ease of a user's customer support experience. CES is based on a seven-point scale ranging from Strongly agree to Strongly disagree. Send customer support surveys to your customers to let them score their experience with one of your support representatives… Please note: you must have an assigned Service Hub seat to create feedback surveys. Learn more in HubSpot's Products & Services catalog. To set up a customer support survey: In your HubSpot account, navigate to Service > Feedback Surveys. You can edit, or delete an existing survey. To edit, hover..."
