ID,Name,Parent,URL,Summary
REV-CRM-4,Track and log emails with the HubSpot Sales Chrome extension | Knowledge Base,CRM Administrators,https://knowledge.hubspot.com/connected-email/track-and-log-emails-with-the-hubspot-sales-chrome-extension,Learn how to send tracked and logged emails from your inbox to HubSpot using the HubSpot Sales Chrome extension.… or their associated records. You can specify email addresses and domains that you never want to log emails for in your HubSpot account settings. Or you can add these email addresses and domains in your Chrome extension settings. Learn more about the difference between tracking and logging. Before you get started… and track settings Permissions required Super Admin…...
REV-CRM-5,Disconnect your LinkedIn Ads account from HubSpot,CRM Administrators,https://knowledge.hubspot.com/ads/disconnect-your-linkedin-ads-account,Learn how to disconnect your LinkedIn Ads account from HubSpot.
REV-CRM-6,Track and log emails with the HubSpot Sales Outlook desktop add-in,CRM Administrators,https://knowledge.hubspot.com/connected-email/track-and-log-emails-with-the-hubspot-sales-outlook-desktop-add-in,"Learn how to track and log emails using the HubSpot Sales Outlook desktop add-in, which is currently in maintenance mode and no longer being developed.… checkbox will not log a copy of the email to the record in HubSpot. Please note: if you've turned on data privacy settings in your account, the HubSpot Sales Outlook add-in will not track email opens and clicks for contacts who have not provided a lawful basis for data processing. Learn more about..."
REV-CRM-1,Assign domain publishing permissions to teams,CRM Administrators,https://knowledge.hubspot.com/domains-and-urls/assign-domain-publishing-permissions-to-teams,"Assign subdomains to teams for streamlined content management. Simplify your workflow by controlling which teams can publish on specific subdomains.… You can assign publishing permissions for connected subdomains to teams. This simplifies the publishing process for large organizations with different teams publishing content on the same content tools. Before you get started Before you begin working with this feature, make sure to fully understand… to their team or are unassigned, users must have Publishing permissions. Understand limitations & considerations To assign a domain to a team, a Marketing Hub or Content Hub Enterprise subscription is required. If a user selects a subdomain in the Settings tab of the…..."
REV-CRM-2,HubSpot user permissions guide,CRM Administrators,https://knowledge.hubspot.com/user-management/hubspot-user-permissions-guide,"A comprehensive overview of HubSpot's user permissions settings.… account(s) when using multi-account management. Commerce On the Commerce tab, set permissions for products, line items, quotes, quote templates, payments, contracts, credit memos, invoices, payment links, and subscriptions. Product and pricing information Create custom line items: toggle the switch..."
REV-CRM-3,Manage user permissions,CRM Administrators,https://knowledge.hubspot.com/user-management/manage-user-permissions,"Learn how to make changes to permissions for users in your HubSpot account. You can do this individually or in bulk.… Permissions define how users can work within HubSpot tools they have access to through their seat. Set permissions to control what users can view, create, edit, or delete in an account. For example, you can give a sales rep permission to communicate only with contacts they own, while allowing..."
REV-CRM-4,View user permissions history,CRM Administrators,https://knowledge.hubspot.com/user-management/view-user-permissions-history,"Learn how to view a user's permission history to troubleshoot permission issues or perform a permissions audit.… Super admins can view a user's permissions history to audit who had permissions and when. This can be helpful when troubleshooting permissions issues or when needing to audit permissions for security compliance. To view a user's permission history: In your HubSpot account, click the settings..."
REV-CRM-5,Set up goal permissions,CRM Administrators,https://knowledge.hubspot.com/goals/set-up-goal-permissions,"You can adjust user permissions for goals to control who can edit and view them.… If you are a Super Admin, you can now control who can view and edit sales goals, service goals, marketing goals, and custom goals through the new Goals permission. For detailed information about what View and Edit permissions allow for goals, learn more in HubSpot’s user permissions guide. How… is my access affected with the introduction of the Goals permission? With the introduction of this permission, some users may gain or lose access to goals they are a part of. You should be aware of the following scenarios that may require you to adjust your user's permissions: Revenue…… ..."
REV-CRM-6,Resolve a 'Request for Integration Permissions' error,CRM Administrators,https://knowledge.hubspot.com/integrations/resolve-a-request-for-integration-permissions-error,"Learn how to resolve a 'Request for Integration Permissions' error that occurs when you attempt to connect an app to HubSpot.… When you try to connect an integration to HubSpot, you may encounter a Request for Integration Permissions error. This type of error occurs because certain integrations require specific user roles or account-wide tools to connect to HubSpot. Users may encounter the following errors when attempting… Couldn't complete the connection. You don’t have permission to connect this integration. What the error means The HubSpot user attempting to connect the integration doesn't have the necessary user roles or permissions to authorize the required scopes requested by the integration. How to resolve..."
REV-CRM-1,Share records with users and teams,CRM Administrators,https://knowledge.hubspot.com/records/share-records,"Learn how to share records of objects that have record pages such as contacts or appointments so they can be accessed by specific users and teams.… only access or both view and edit access. Any user or team member with view and edit access can share records. Click Save. Learn more about restricting view and edit access for properties. Share records Permissions required Access to the Shared users or Shared teams properties or Super Admin… To give users access to records in addition to those they own, you can share individual records. You can share HubSpot-defined and custom objects that have a record page (e.g., contacts, appointments, deals). When you share…..."
REV-CRM-2,Share sales content with users and teams,CRM Administrators,https://knowledge.hubspot.com/sequences/share-sales-content-with-users-and-teams,"Actions > Manage sharing. In the right panel, select the radio button next to the desired sharing setting: Only me: only the content creator can view and use the sales content. Everyone: everyone can view and use the sales content. Specific users and teams: only specific users and teams can view and use… the sales content. To grant access, select the checkboxes next to the teams or users. This option can only be selected by Super admins or users with assigned Sales Hub or Service Hub seats. Click Save. Bulk share sequences To configure your sharing settings for multiple sequences: In your HubSpot… view and use the sales content. Specific users and teams:…..."
REV-CRM-3,Review permission-related product updates,CRM Administrators,https://knowledge.hubspot.com/account-management/review-permission-related-product-updates,"View permission-related product updates directly in your Users & Teams settings to stay informed about recent changes while managing permissions.… your user permission setup. Permissions required Super Admin permissions are required to review permission-related product updates. To view permission-related product updates: In your HubSpot account, click the settings settings icon in the top navigation bar. In the left sidebar menu, navigate… You can review the latest permission-related product updates directly from your Users & Teams settings. These updates appear in a side panel so you can understand recent permission changes without navigating away from the…..."
REV-CRM-4,Gjennomgå tillatelsesrelaterte produktoppdateringer,CRM Administrators,https://knowledge.hubspot.com/no/account-management/review-permission-related-product-updates,"Se tillatelsesrelaterte produktoppdateringer direkte i Users & Teams-innstillingene for å holde deg informert om nylige endringer mens du administrerer tillatelser.… Du kan se de nyeste produktoppdateringene som gjelder tillatelser, direkte fra Users & Teams-innstillingene . Disse oppdateringene vises i et sidepanel, slik at du kan se de siste endringene i tillatelsene uten å måtte navigere bort fra siden. Dette hjelper deg med å holde deg informert om..."
MAR-MAR-1,Use the updated report viewer and dashboards,Marketing Leadership,https://knowledge.hubspot.com/reports/use-the-updated-report-viewer-and-dashboards,"Users with a Starter subscription can use the reporting analytics suite and dashboards to learn more about their company's data.… If you have a Starter subscription, you can access a curated set of reporting templates and dashboards that display different analytics. View report templates To view report templates: In your HubSpot account, navigate to Reporting > Reports. In the left sidebar menu, reports are organized..."
MAR-MAR-3,Use marketing reports in the marketing analytics suite,Marketing Leadership,https://knowledge.hubspot.com/reports/use-marketing-reports-in-the-marketing-analytics-suite,"Learn how to create marketing reports using the marketing analytics tool.… Use marketing analytics reports to analyze what channels are driving the most engagement, how your website is performing, and contact insights. Once you've customized a report, you can save the report or add it to a dashboard. View, select, and save a marketing report In your HubSpot account..."
MAR-MAR-1,Analyze your campaign ROI,Marketing Leadership,https://knowledge.hubspot.com/campaigns/analyze-your-campaign-roi,"Learn how to review and analyze your campaign ROI report.… Use the campaign ROI report to measure the effectiveness of your campaigns. You can also configure your ROI calculation to determine how exactly you want to measure the effectiveness of your campaigns. You can also further analyze your campaigns performance in the campaigns tool. Learn more about… Attribution reports, within the Influenced contacts and Website traffic reports. Configure the calculation of your campaign ROI…..."
MAR-MAR-2,Configure the calculation of ROI for paid ad campaigns,Marketing Leadership,https://knowledge.hubspot.com/ads/configure-the-calculation-of-roi-for-paid-ad-campaigns,"Learn how to configure the calculation of ROI for paid ad campaigns in HubSpot's ads tool.… Configure your ROI calculation to determine how exactly you want to measure the effectiveness of your paid ad campaigns within HubSpot. To configure the calculation of ROI for your paid ad campaigns: In your HubSpot account, navigate to Marketing > Ads. In the upper right, click the settings..."
MAR-MAR-1,Tracking URL sessions are not appearing in your traffic analytics,Marketing Leadership,https://knowledge.hubspot.com/reports/why-are-tracking-url-sessions-not-appearing-in-the-sources-report,"If you are not seeing sessions from your tracking URL, there are few things to check to make sure you're capturing this information in the sources report.… If tracking URL sessions are not showing up on the Sources tab in your traffic analytics as expected, verify the following: Sessions will only appear in the sources report if the tracking URL has been viewed at least once during the time frame of the current view. Click on the dropdown at the top..."
MAR-MAR-2,Ad tracking in HubSpot,Marketing Leadership,https://knowledge.hubspot.com/ads/ad-tracking-in-hubspot,"Learn how to set up ad tracking in HubSpot, and how HubSpot tracks which ads your contacts are clicking and converting on.… be tracked. Leads who submit Lead Gen Forms on any ad type will sync to HubSpot, even if the ad type is not trackable. Carousel image ads can be tracked. If you edit the name of an ad campaign, the utm_campaign value in HubSpot's tracking template will not automatically update. HubSpot will continue… And LinkedIn Ads. By default, HubSpot's tracking template includes utm parameters to match HubSpot's traffic analytics. If you want to override the utm_source or utm_medium…..."
MAR-MAR-4,Create tracking URLs,Marketing Leadership,https://knowledge.hubspot.com/settings/how-do-i-create-a-tracking-url,"Learn how to create, use, and analyze tracking URLs, which add parameters to your URLs and allow you to effectively track engagements with your marketing campaigns.… creating tracking a URL because the campaign name is used in several reports in HubSpot. Visits to the tracking URL will be attributed to this campaign in the sources report and will count towards the analytics for the campaign in the campaigns tool. Click the Source dropdown menu and select the source… Summary Use tracking URLs to measure the effectiveness of your marketing…..."
MAR-MAR-5,Troubleshoot the HubSpot tracking code,Marketing Leadership,https://knowledge.hubspot.com/reports/how-do-i-know-if-my-hubspot-tracking-code-is-working,"If you're not seeing any website traffic data, verify that the tracking code has been installed and that it's firing correctly.… see the HubSpot Embed Code or Async HubSpot Analytics Code. These are both HubSpot tracking codes and indicate that your tracking code has been installed. If you're using Google Tag Manager or another script loader, the tracking code will not appear in the page source. The tracking code will appear… The HubSpot tracking code allows HubSpot to track visitors…..."
MAR-MAR-6,Set up site tracking in HubSpot,Marketing Leadership,https://knowledge.hubspot.com/reports/set-up-sources-tracking,"Customize how you're tracking your website analytics.… Once you've installed the HubSpot tracking code, you may need to do some additional setup to ensure that HubSpot gathers analytics for all of the domains and subdomains on your website. Some of this data will be displayed in your reports and analytics tools. Apart from setting up your site tracking… domain in the Company domain field. This is the domain used in your analytics tools. At the bottom of the screen, click Save. If you are hosting your site externally (i.e., your domain is not connected to HubSpot), the HubSpot tracking code needs to be embedded on your external site. Without..."
MAR-FRO-1,Use campaigns with workflows,Frontline Managers,https://knowledge.hubspot.com/workflows/create-campaign-based-workflows,Learn how to create campaign-based workflows and use campaigns with workflows to automate your campaigns (BETA).
MAR-FRO-2,Set up quote approvals,Frontline Managers,https://knowledge.hubspot.com/quotes/set-up-quote-approvals,"Set up quote approvals in Commerce Hub to ensure accuracy and consistency, with options for standard approvals and advanced approval workflows."
MAR-FRO-3,Require approvals for deals,Frontline Managers,https://knowledge.hubspot.com/object-settings/pipeline-approvals,"Learn how to set up and use approval requirements for users moving deals through pipeline stages.… approval before they can moved forward in the pipeline. Also, users will be unable to create deals past the approval stage. This includes deals created from workflows. Each pipeline can have a unique approval stage with up to three approvers. For example, you may have one sales process that needs..."
MAR-FRO-4,Overview of approvals in HubSpot,Frontline Managers,https://knowledge.hubspot.com/account-management/overview-of-approvals-in-hubspot,"Understand which HubSpot features allow you to set up approvals in HubSpot.… compliance with internal processes, and reduces the risk of publishing or sharing incorrect information. For example, a sales manager can require approval before a deal moves to a closed stage, or a marketing manager can approve a marketing email before it’s sent to contacts. Before you get started… Update your notifications, Slack, or Microsoft Teams for real-time approval notifications by turning on the Approval activity notification. Learn more about managing your Slack and Microsoft Teams notifications. Each feature requires different subscriptions, seats, and permissions. Refer..."
MAR-FRO-5,Manage quote approvals,Frontline Managers,https://knowledge.hubspot.com/quotes/manage-quote-approvals,"Learn how to manage and approve quotes, including request changes, and finalizing approvals.… that need approval directly from the notification for approval, or from the quotes index page. Approvers can't approve their own quotes. To access the quote approval, you can either: Click Go to quote on the notification. You'll receive notifications according to your notification settings when a quote… needs approval. In your HubSpot account, navigate to Commerce > Quotes. Above the quotes table, click the Status filter and select Pending approval.…..."
MAR-FRO-6,Require approvals for exports,Frontline Managers,https://knowledge.hubspot.com/import-and-export/export-approvals,"Learn how to set up approval requirements for users exporting records.… You can set up an approval process for CRM exports so that user exports must be reviewed and approved before records are exported from your account. When export approvals are turned on, users whose exports meet the specified criteria cannot export records, segments, or property history without… approval. Please note: other assets and tools in your account (e.g., single-object or custom reports) cannot be configured for export approval. Also, your account may use personalized names for each object (e.g., account instead of company). This article refers to objects by their HubSpot default…..."
MAR-FRO-1,Reporting & Data,Frontline Managers,https://knowledge.hubspot.com/reporting-and-data,
MAR-FRO-1,Manage user permissions,Frontline Managers,https://knowledge.hubspot.com/user-management/manage-user-permissions,"Learn how to make changes to permissions for users in your HubSpot account. You can do this individually or in bulk.… a sales manager to communicate with all contacts. Learn more about each user permission. View a user's permissions history to track their permission changes over time. Before you get started Before you begin setting user permissions, make sure to fully understand what steps should be taken ahead of time..."
MAR-FRO-2,HubSpot user permissions guide,Frontline Managers,https://knowledge.hubspot.com/user-management/hubspot-user-permissions-guide,"A comprehensive overview of HubSpot's user permissions settings.… Permissions define how users can work within HubSpot tools they have access to through their seat. Super Admins can set user permissions to control what users can view, create, edit, or delete in an account. For example, you can give a sales rep permission to communicate only with contacts they own..."
MAR-FRO-3,Set up goal permissions,Frontline Managers,https://knowledge.hubspot.com/goals/set-up-goal-permissions,"You can adjust user permissions for goals to control who can edit and view them.… If you are a Super Admin, you can now control who can view and edit sales goals, service goals, marketing goals, and custom goals through the new Goals permission. For detailed information about what View and Edit permissions allow for goals, learn more in HubSpot’s user permissions guide. How… is my access affected with the introduction of the Goals permission? With the introduction of this permission, some users may gain or lose access to goals they are a part of. You should be aware of the following scenarios that…… ..."
MAR-FRO-4,Limit access to logged emails in the CRM,Frontline Managers,https://knowledge.hubspot.com/connected-email/limit-access-to-logged-emails-in-the-crm,"Learn how to manage user access to CRM emails.… to the emails that are relevant to them. Edit user permissions for CRM emails In your HubSpot account, click the settings settings icon in the top navigation bar. In the left sidebar menu, navigate to Users & Teams. Hover over the user you want to edit and click Edit permissions. Under the Choose..."
MAR-FRO-5,View user permissions history,Frontline Managers,https://knowledge.hubspot.com/user-management/view-user-permissions-history,"Learn how to view a user's permission history to troubleshoot permission issues or perform a permissions audit.… Super admins can view a user's permissions history to audit who had permissions and when. This can be helpful when troubleshooting permissions issues or when needing to audit permissions for security compliance. To view a user's permission history: In your HubSpot account, click the settings… settings icon in the…… ..."
MAR-FRO-6,Set contacts as marketing,Frontline Managers,https://knowledge.hubspot.com/records/set-contacts-as-marketing,"information log, the workflow was temporarily unable to communicate with other tools in HubSpot and couldn't update the contacts' statuses. The action will automatically retry until it's successful. Learn more about using workflows. Remove a user's permissions to set contacts as marketing To change… user permissions for marketing contact access: In your HubSpot account, click the settings settings icon in the top navigation bar. In the left sidebar menu, navigate to Users & Teams. In the table, hover on a user and click Edit permissions. In…..."
MAR-MAR-1,Understand marketing contacts billing,Marketing Ops,https://knowledge.hubspot.com/account/understand-marketing-contacts-billing,Learn how marketing contacts impacts your billing and how to manage your marketing contacts.
MAR-MAR-2,Understand the Enterprise Flex Program and Flex Seats,Marketing Ops,https://knowledge.hubspot.com/account-management/understand-the-enterprise-flex-program-and-flex-seats,"The Enterprise Flex Program (EFP) gives Enterprise customers flexible access to HubSpot’s Enterprise subscriptions, HubSpot Credits and marketing contacts. With EFP, you can scale user access using Flex Seats, which use a true-up billing model that adjusts your seat commitment based on average… If you’re assigning a seat and you have exceeded the number of committed seats, a notification will inform you that you’ll be charged at your next bill date. At the bottom, click Save. HubSpot Credits and marketing contacts billing EFP accounts also…… ..."
MAR-MAR-3,Set contacts as non-marketing,Marketing Ops,https://knowledge.hubspot.com/records/set-contacts-as-non-marketing,Learn how to set your contacts as non-marketing and their impact on your billable contact tier and marketing tools.
MAR-MAR-4,Set contacts as marketing,Marketing Ops,https://knowledge.hubspot.com/records/set-contacts-as-marketing,"Learn how to set your contacts as marketing through tools such as an index page, import, segment, or workflow.… more about checking if your account has access to marketing contacts, using marketing contacts, or how to navigate marketing contacts billing. Subscription required A Marketing Hub Starter,…..."
MAR-MAR-5,Import records for a single object,Marketing Ops,https://knowledge.hubspot.com/import-and-export/import-records-for-a-single-object,"for processing data: If you've turned on data privacy settings in your account, configure the legal basis for importing and using the contact's data. Marketing contact status: set contacts as marketing so they can be used in marketing tools (e.g., marketing email). Learn more about marketing contacts billing… Use HubSpot’s import tool to add or update data in bulk using spreadsheet files. You can import records (e.g.,…… for a…..."
MAR-MAR-6,Understand marketing contacts,Marketing Ops,https://knowledge.hubspot.com/records/marketing-contacts,Learn how to manage the number of contacts that count towards your contact tier and can work with your email marketing and ad targeting tools in HubSpot.
MAR-MAR-1,Configure buyer intent,Marketing Ops,https://knowledge.hubspot.com/reports/configure-buyer-intent,"A cookie consent banner allows visitors to opt in or opt out of being tracked in your HubSpot account with cookies. This feature works for all HubSpot pages as well as any external pages with your HubSpot tracking code installed. See below for more resources on how HubSpot enables customers to comply with data protection laws. GDPR Compliance CCPA Compliance… Learn how to set up buyer intent to define your target market, intent criteria, and confirm that your HubSpot tracking code has been installed and is successfully firing on your website (BETA..."
MAR-MAR-2,Use compliance copy emails,Marketing Ops,https://knowledge.hubspot.com/marketing-email/set-up-a-compliance-copy-email,"Learn more about setting up a compliance copy email to send whenever marketing emails are sent.… With compliance copy email, you can automatically send BCCs of all outgoing marketing emails to a designated email address. This allows you to keep records of your outgoing messages in one place for compliance purposes. Understand limitations and considerations When you send a marketing email… A separate compliance copy email will be sent for each unique recipient. This can result in a higher volume of emails than some email providers support. Any compliance copy emails sent count towards your email send…..."
