ID,Name,Parent,URL,Summary
SAL-SAL-3,Ad tracking in HubSpot,Sales Leadership,https://knowledge.hubspot.com/ads/ad-tracking-in-hubspot,"Learn how to set up ad tracking in HubSpot, and how HubSpot tracks which ads your contacts are clicking and converting on.… Set up ad tracking in HubSpot and learn how HubSpot tracks which ads your contacts are clicking and converting on. How ad tracking in HubSpot works Tracking allows HubSpot to attribute contacts to specific ads, by applying tracking parameters to the end of your ad URLs. After you connect your ad… account, HubSpot will apply tracking to ads that are currently active or pending review. If HubSpot is unable to track an ad,…..."
SAL-SAL-5,Create tracking URLs,Sales Leadership,https://knowledge.hubspot.com/settings/how-do-i-create-a-tracking-url,"Learn how to create, use, and analyze tracking URLs, which add parameters to your URLs and allow you to effectively track engagements with your marketing campaigns.… Summary Use tracking URLs to measure the effectiveness of your marketing campaigns. A tracking URL is a URL with parameters attached. When visitors navigate to your site from a tracking URL, HubSpot saves the information in those parameters. Learn how to analyze traffic data from tracking URLs… in the traffic analytics tool. In this article, learn how to create a tracking URL,…… ..."
SAL-SAL-2,Set up multi-account management,Sales Leadership,https://knowledge.hubspot.com/account-management/set-up-multi-account-management,"Learn how to set up multi-account management, allowing multiple businesses to work separately, while being able to share assets and data across accounts.… Multi-account management is a feature for customers with multiple HubSpot accounts. Multi-account management allows multiple businesses to work separately, while being able to share assets and data across accounts. Learn more about multi-account management from our HubSpot Academy… The functionality of multi-account management includes: Organization configuration: set up your organization and define the connections between accounts that decide how…..."
SAL-SAL-3,Use cookie management tools in HubSpot,Sales Leadership,https://knowledge.hubspot.com/privacy-and-consent/use-cookie-management-tools-in-hubspot,is the best resource to give you compliance advice for your specific business circumstances. Understand cookie management Cookies are small data files that can be used to identify your website visitors and track their behavior. There are worldwide laws and regulations that protect the privacy… Ensure your website is compliant with applicable data regulation laws. HubSpot has tools to help you comply with these laws...
SAL-SAL-4,Troubleshoot the HubSpot cookie consent management tools,Sales Leadership,https://knowledge.hubspot.com/troubleshoot-the-hubspot-cookie-consent-management-tools,"While using HubSpot’s consent management tools you may encounter errors. Review common errors and the typical steps for resolution.… You may encounter errors while adding your website to consent management tools. The table below explains the errors in detail and the steps needed to resolve: Once you have confirmed the above requirements are met, review the table below which explains the errors in detail and the steps needed… While using HubSpot’s consent management tools you may encounter errors. Below are some common errors and the typical steps for resolution."
SAL-SAL-5,Mirror data between HubSpot accounts with multi-account management,Sales Leadership,https://knowledge.hubspot.com/account-management/mirror-data-between-hubspot-accounts,"Learn how to set up aata mirroring, a feature of multi-account management, allowing you to mirror data between different HubSpot accounts.… With data mirroring, a feature of multi-account management, you can mirror contact and company data between different HubSpot accounts. For example, a sales representative in one account is interacting with a contact who bought something from another business entity. That business entity has..."
SAL-SAL-6,Copy assets to another HubSpot account with multi-account management,Sales Leadership,https://knowledge.hubspot.com/account-management/copy-assets-to-another-hubspot-account,"Learn how to set up asset copying, a feature of multi-account management, allowing you to copy automated marketing emails, forms, and lists to other HubSpot accounts.… Asset copying, a feature of multi-account management, allows you to copy automated marketing emails, forms, segments, and workflows to other HubSpot accounts in your multi-account management organization. Permissions required Super Admin permissions are required in the account that you're copying..."
SAL-FRO-2,Use the help desk coaching page,Frontline Managers,https://knowledge.hubspot.com/help-desk/use-the-help-desk-coaching-page,"Track and improve your support team's performance with coaching metrics, including SLA compliance and customer satisfaction.… On the Coaching page in help desk, you can track key coaching metrics to evaluate whether your support team is responding to and closing tickets within SLA, as well as monitor CSAT and CES scores. Support leaders can view and compare metrics for their entire team, while support reps can access..."
SAL-FRO-4,Use coaching playlists to train your team,Frontline Managers,https://knowledge.hubspot.com/calling/use-coaching-playlists-to-train-your-team,"Create coaching playlists containing call recordings to train team members.… You can create coaching playlists containing complete or clipped call recordings to help train your team members. Playlists can help you teach soft skills and selling tactics, or train existing team members on how to position a new product. You can then put your playlists into folders to organize… Adding a recording to a playlist won't override this permission. Create a coaching playlist Navigate to one of the following: In your HubSpot account, navigate to Sales > Coaching Playlists. In your HubSpot account, navigate to CRM > Calls. Click Playlists on the top right. Click Create…… ..."
SAL-FRO-1,Manage reports in your reports list,Frontline Managers,https://knowledge.hubspot.com/reports/manage-reports-in-your-reports-list,Learn how to manage your reports with the reports list.… Sales impact journeys Attribution reporting Multi-touch attribution Channel performance Ads Forms CRM insights Contacts Sales Coach reps & teams Call outcomes Chats Completed activies Deal created Lead funnel Lead response time Meeting outcomes Prospecting activities Tasks completed Team activity
SAL-FRO-2,Create reports with the custom report builder,Frontline Managers,https://knowledge.hubspot.com/reports/create-reports-with-the-custom-report-builder,"Learn how to create reports with the new custom report builder.… steps: Select the report's data sources: select the types of HubSpot data that the report will include. Add fields to the report: select the specific property, event, and activity data to report on. Customize report filters: set limits and boundaries for the fields you've added. Configure report… Configure the report Select specific properties, activity measurements, and events to add data to your report. The available fields will be based on the data sources you select for the report. The amount of fields you can add to a report depends on the report type: Vertical bar, line, and area charts..."
SAL-FRO-3,Interact with reports in the report viewer,Frontline Managers,https://knowledge.hubspot.com/reports/interact-with-reports-in-the-report-viewer,"The report viewer lets you save and quickly switch between up to five unique visual configurations within a single report… The report viewer lets you save and quickly switch between up to five unique visual configurations within a single report. It offers an intuitive interface for analyzing, filtering, and gaining insights from your reports without needing to manually reconfigure or duplicate reports. Access the report..."
SAL-FRO-4,Use a report from the report library,Frontline Managers,https://knowledge.hubspot.com/reports/use-a-report-from-the-report-library,"Learn how to find a standard report from the report library and save it to your dashboard or reports list.… HubSpot's report template library contains standard reports that you can save to your reports list or add to your dashboards. These reports cover many different topics such as website performance and sales metrics. To find a suitable standard report: In your HubSpot account, navigate to Reporting..."
SAL-FRO-5,Report on ad campaigns using the custom report builder,Frontline Managers,https://knowledge.hubspot.com/ads/report-on-ad-campaigns-using-the-custom-report-builder,"Learn how to use the custom report builder to report on your ad campaign performance.… Then select Ad performance metrics. Click Next. Select specific properties, activity measurements, and events to add data to your report: To search for specific properties, in the Search across sources search box, enter the property name. Click and drag the property from the left sidebar..."
SAL-FRO-6,Create goal reports in the custom report builder,Frontline Managers,https://knowledge.hubspot.com/goals/create-goal-reports-in-the-custom-report-builder,"With the custom report builder, you can report on goals alongside deals and other CRM data.… With the custom report builder, you can report on goals alongside deals and other CRM data. Select goals as the primary data source, join it to deals, and optionally, join deals to contacts, companies, activities, meetings, and other CRM objects using cross‑object reporting. Use case A vice..."
SAL-FRO-1,Set up pipeline automations for objects,Frontline Managers,https://knowledge.hubspot.com/object-settings/set-up-pipeline-automations-for-objects,"Automate actions for deals, projects, tickets, and custom objects. Trigger tasks, notifications, and emails based on pipeline stage or status.… more about using the full workflow editor. Permissions required Super Admin or Workflow edit permissions are required to configure pipeline automations. Automate actions based on pipeline stages You can create automations based on deal, project, ticket, and custom object pipeline stages..."
SAL-FRO-2,Set up rules for object pipelines,Frontline Managers,https://knowledge.hubspot.com/object-settings/set-up-pipeline-rules,"Learn to configure deal, ticket, lead, project, and custom object pipeline rules in HubSpot such as stage progression and editing access.… To manage how users can create and move records through a pipeline, set rules for your deal, ticket, lead, project, appointment, course, service, listing, order, and custom object pipelines. The following rules can be enforced for each individual pipeline: Set stages where new records can..."
SAL-FRO-3,Customize the board view for objects with pipelines,Frontline Managers,https://knowledge.hubspot.com/object-settings/select-properties-to-show-on-records-in-board-view,"Learn how to customize the properties shown on board cards and the appearance of your pipelines in board view for objects such as contacts or deals.… In a board view, you can manage your records in a card layout. For deal, ticket, admin-activated (e.g., services), and custom object records, you can filter by pipeline. For contact and company board views, the pipeline is Lifecycle stage. You can customize the board cards to display… to the board view of the pipeline. Set a preferred currency and currency formatting Subscription required A…..."
SAL-FRO-1,Use playbooks,Frontline Managers,https://knowledge.hubspot.com/playbooks/use-playbooks,"Learn how to use playbooks to allow your sales and services team members to reference and create standardized notes when speaking with prospects and customers.… Professional or Enterprise only). View reporting analytics for playbooks You can view playbook reporting analytics to gain better insight into your playbooks, who is using them, and how well they are working. In your HubSpot account, navigate to CRM > Playbooks. At the top, click the Analyze tab. At the top… An assigned Sales or Service seat is required to create, edit, view, and…..."
SAL-FRO-5,Reporting & Data,Frontline Managers,https://knowledge.hubspot.com/reporting-and-data,
SAL-SAL-2,HubSpot's default deal properties,Sales Ops,https://knowledge.hubspot.com/properties/hubspots-default-deal-properties,"Learn more about the definitions of HubSpot's default deal properties.… is set automatically by HubSpot. Pipeline: the pipeline a deal is in, which determines the deal stages the deal will move through. You can learn more about how to set up your deal pipelines and deal stages here. Source of last booking in meetings tool: this UTM parameter shows which site (e.g… HubSpot has a number of default deal properties to help track…..."
SAL-SAL-4,Define your data model with recommendations,Sales Ops,https://knowledge.hubspot.com/data-management/data-model-templates,"recommendations are available: Real estate: for real estate companies, such as agencies and property management firms, that work with real estate listings. This recommendation activates the Listings object and associates it with contacts. It also includes recommended custom properties and deal pipelines… You can apply data model recommendations that automatically create objects, properties, pipelines, and associations relevant to your industry. Using a recommendation, you can skip the manual work of setting up your data model and more efficiently and reliably track data in your CRM database. You… Then click Confirm. A banner will appear letting you know the recommendation was applied successfully. To view more…..."
SAL-SAL-5,Create custom funnel reports,Sales Ops,https://knowledge.hubspot.com/reports/create-new-custom-funnel-reports,"Analyze conversion rates between stages with custom funnel reports. You can choose between lifecycle stages or deal pipelines. Please note: the following functionality is currently in beta. To access the beta a Super Admin in the account needs to navigate to the funnel builder and click Get early… Funnel report. Click Next. Select a data source. Contacts: measures how contacts are moving through their respective lifecycle stages. Companies: measures how companies are moving through their respective lifecycle stages. Deals: measures how deals are moving through their respective deal stages… the events you want to include in that stage. Then click Save. To make a stage optional, hover over the stage, and select edit…..."
SAL-SAL-6,Set up and manage object pipelines,Sales Ops,https://knowledge.hubspot.com/object-settings/set-up-and-customize-pipelines,"Learn how to create, clone, customize and delete your pipelines and stages in HubSpot.… Pipelines help visualize your processes through stages, which are steps that signal where a record is in a process. For example, you can create deal pipelines to track revenue, ticket pipelines to track customer issues, or listing pipelines to track for-sale properties. Please note: your account..."
SAL-SAL-1,Create sales reports in the sales analytics suite,Sales Ops,https://knowledge.hubspot.com/reports/create-sales-reports-in-the-sales-analytics-suite,"dropdown menu and select how you want to view the goal. Weighted forecast category: the forecasted revenue of your deals by forecast category, calculated using the weighted amount of each deal. Learn how to configure forecast weights in your forecast settings. Weighted pipeline forecast: for each..."
SAL-SAL-2,Manage reports in your reports list,Sales Ops,https://knowledge.hubspot.com/reports/manage-reports-in-your-reports-list,timeline Time spent in deal stage Forecasts & pipelines Deal change history Deal funnel Deal pipeline waterfall Deal push rate Forecast category Historical snapshots Quota attainment Weighted forecast category Weighted pipeline forcast Sales outcomes Average deal size Deal loss reasons Deal revenue… Learn how to manage your reports with the reports list...
SAL-SAL-3,Use the forecast tool,Sales Ops,https://knowledge.hubspot.com/forecast/use-the-forecast-tool,"Use the forecast tool to keep track of your team's progress towards closing deals and meeting their revenue goals.… revenue goal. Weighted pipeline or Total pipeline: the amount of all forecasted deals for the time period. If your Forecast deal amount settings are set to Weighted amount, Weighted pipeline will be displayed. If your Forecast deal amount settings are set to Total amount, Total pipeline..."
SAL-SAL-4,Set up the forecast tool,Sales Ops,https://knowledge.hubspot.com/forecast/set-up-the-forecast-tool,"Learn how to set up and customize the forecast tool to track your sales team's progress and set forecastable revenue goals.… in the forecast tool and related reports. Existing and new users with Forecast permissions will be set to use Weighted amount by default. In your HubSpot account, click the settings settings icon in the top navigation bar. In the left sidebar menu, navigate to Objects > Forecast. Click the Forecast deal..."
SAL-SAL-5,Improve forecasting with AI projections,Sales Ops,https://knowledge.hubspot.com/forecast/improve-forecasting-with-ai-projections,"Navigate to Sales > Forecast. Click the Analyze tab. Use the dropdown menus at the top to filter by pipeline. In the Overview for all teams table at the top, you can view the following: Weighted pipeline value: the total Amount multiplied by the Deal probability of all deals including Closed won deals… > Forecast. Click the Analyze tab. Click Turn on AI forecasting. Then, click Yes, turn on AI forecasting to confirm you would like to turn on the feature. After you opt-in to the feature, there is a waiting period of 24 hours or more while data is collected to make the most accurate predictions. If you..."
SAL-SAL-6,Track the accuracy of forecasts,Sales Ops,https://knowledge.hubspot.com/forecast/track-the-accuracy-of-forecasts,"With forecast accuracy tracking, you can measure the reliability of your forecasts and the effectiveness of your forecasting process.… With forecast accuracy tracking, you can measure the reliability of your forecasts and the effectiveness of your forecasting process. Accurate forecasts can help you identify trends and improve the performance of your forecasts so managers can coach reps and reps can gain more visibility… into…..."
SAL-SAL-1,Create and edit properties,Sales Ops,https://knowledge.hubspot.com/properties/create-and-edit-properties,"to creating a property you should: Review the property editor terminology and layout. Check whether a default HubSpot-provided property can meet your data requirements before creating a custom property. Learn more about the default properties for contacts, companies, deals, tickets, leads, line items… that cannot be modified. Updates to the product property value sync to the line item property to maintain data alignment. Custom line item properties don't affect products. Create a property with Breeze Create text, number, phone number, enumeration, date, file, URL, and HubSpot user properties using…… ..."
SAL-SAL-2,Use line items,Sales Ops,https://knowledge.hubspot.com/products/edit-products-and-terms-in-the-line-items-editor,"Learn how to use line items in credit memos (BETA), deals, invoices, payment links, quotes, and subscriptions."
SAL-SAL-3,Use line items with deals,Sales Ops,https://knowledge.hubspot.com/records/use-line-items-with-deals,"Manage line items on deals in HubSpot. Learn how to add, edit, and delete line items, apply discounts and taxes, and understand deal amount calculations."
SAL-SAL-4,Add line items to deals using workflows,Sales Ops,https://knowledge.hubspot.com/workflows/add-line-items-to-deals-using-workflows,"Learn how to add line items to deals using the 'Add line item' workflow action.… the + plus icon to add an action. In the left panel, click to expand the CRM section. Then, click Add line item to deal. Configure the Add line item to deal action: Deal: choose to associate the line items with the enrolled deal or a different associated deal. Product: select the line item that you'd… Available with any of the following…… like to…..."
SAL-SAL-5,Create and manage products,Sales Ops,https://knowledge.hubspot.com/products/create-and-manage-products,"Learn how to create a product library with flat-rate and tiered-priced products, manage your product library, export products, and associate products with deals.… Create a product library of the goods and services to sell in HubSpot, and associate them as line items to deals, invoices, payment links, quotes, legacy quotes, and subscriptions. When creating products, they can be priced at a flat rate or tiered. For example, you may want to assign volume-based..."
SAL-SAL-6,View purchased products on contact and company records,Sales Ops,https://knowledge.hubspot.com/products/view-purchased-products-on-contact-and-company-records,"By adding the Product history card to the middle column of your contact and company records, you can quickly view information about the products a customer has purchased. The card displays a table of line items, along with other details including price, quantity, and last purchase date. The line… the Product history card to see the line items that are associated with the contact or company's most recent 100 deals or orders. To view orders instead of deals, click the Deal dropdown menu in the upper left of the card, then select Order. Use the…..."
SAL-SAL-1,Compare Sales Hub legacy quotes and Commerce Hub quotes,Sales Ops,https://knowledge.hubspot.com/quotes/compare-legacy-quotes-and-quotes,"Compare legacy quotes and CPQ quotes. Discover key features, differences, and how to optimize your quoting process.… Quote editor Multi-tab quote editor. Single-page, drag-and-drop editor. Quote templates Three default templates available, with the option to create new templates. Learn more about legacy quote templates. Customize quotes using branding and templates, giving sellers and buyers a standardized… experience with your quotes. Learn more about quote branding and templates. Products Free accounts: up to 100 products . Starter, Professional, and Enterprise: Up to 1 million products. Commerce…..."
SAL-SAL-4,Automation,Sales Ops,https://knowledge.hubspot.com/automation,
SAL-ACC-1,Improve forecasting with AI projections,Account Executives (AEs),https://knowledge.hubspot.com/forecast/improve-forecasting-with-ai-projections,"organization, so all deals factor into these tables. Please note: this feature is in BETA, learn how to opt your account into the beta. Set up AI forecasting To set up Breeze forecasting or opt-out, you must be a super admin. To set up Breeze forecasting: In your HubSpot account, navigate to Sales… > Forecast. Click the Analyze tab. Click Turn on AI forecasting. Then, click Yes, turn on AI forecasting to confirm you would like to turn on the feature. After you opt-in to the feature, there is a waiting period of 24 hours or more while data is collected to make the most accurate predictions. If you..."
SAL-ACC-4,Create deals,Account Executives (AEs),https://knowledge.hubspot.com/records/create-deals,"Learn about creating deals in HubSpot.… Use deals in HubSpot to track potential revenue through your sales process. You can associate deals with other records, such as contacts and companies involved in the deal. Once records are associated to a deal, HubSpot can associate the relevant activities to the deal record. To customize how..."
SAL-ACC-1,Create product bundles in the product builder,Account Executives (AEs),https://knowledge.hubspot.com/create-product-bundles,"other products. Next steps Learn more about creating invoices. Learn more about creating payment links. Learn more about creating quotes. Learn more about creating subscriptions.… to make the product available in deals, quotes, and payment tools, in the upper right, toggle the Active switch off. Please note: inactive products will still be available in reporting and marketing emails. In the upper right, click Create and add another to create this bundle and add another… Or Create to create this bundle and return to the products index page.…… ..."
SAL-ACC-2,Understanding the buyer checkout experience,Account Executives (AEs),https://knowledge.hubspot.com/payment-processing/buyer-checkout-experience,their payment is due. Next steps Learn more about configuring the buyer checkout experience. Learn more about creating invoices. Learn more about creating payment links. Learn more about creating quotes. Learn more about creating subscriptions. Learn more about managing payments.
SAL-ACC-3,Set up currencies for payment collection,Account Executives (AEs),https://knowledge.hubspot.com/payment-processing/configure-currencies-for-commerce-hub,"more about configuring the buyer checkout experience. Learn more about creating invoices. Learn more about creating payment links. Learn more about creating quotes. Learn more about creating subscriptions. Learn more about managing payments.… In this article, learn how to set up your currencies and use them across invoices, payment links, quotes, and subscriptions. If you've set up HubSpot payments or connected Stripe as a payment processing option, you can collect payment in different international currencies, including USD, CAD, EUR..."
